id,rank,rankUpDown,title,fullTitle,year,image,crew,imDbRating,imDbRatingCount
tt1877830,86,-2,The Batman,The Batman (2022),2022,https://m.media-amazon.com/images/M/MV5BM2MyNTAwZGEtNTAxNC00ODVjLTgzZjUtYmU0YjAzNmQyZDEwXkEyXkFqcGdeQXVyNDc2NTg3NzA@._V1_Ratio0.6763_AL_.jpg,"Matt Reeves (director), Robert Pattinson, Zoë Kravitz, Jeffrey Wright, Colin Farrell",7.8,746579
tt2906216,87,+9,Dungeons & Dragons: Honor Among Thieves,Dungeons & Dragons: Honor Among Thieves (2023),2023,https://m.media-amazon.com/images/M/MV5BZWM5MTQ3NDMtNGFiMS00Y2E5LWE2ZTUtNzM5MTcyZjM3ODRiXkEyXkFqcGdeQXVyMDM2NDM2MQ@@._V1_Ratio0.6763_AL_.jpg,"John Francis Daley (director), Jonathan Goldstein (director), Chris Pine, Michelle Rodriguez, Regé-Jean Page, Justice Smith",7.3,203225
tt15789038,88,-17,Elemental,Elemental (2023),2023,https://m.media-amazon.com/images/M/MV5BZjYxYWVjMDMtZGRjZS00ZDE4LTk0OWUtMjUyOTI4MmYxNjgwXkEyXkFqcGdeQXVyMTUzMTg2ODkz._V1_Ratio0.6763_AL_.jpg,"Peter Sohn (director), Leah Lewis, Mamoudou Athie, Ronnie Del Carmen, Shila Ommi",7,99733
tt6791350,89,-19,Guardians of the Galaxy Vol. 3,Guardians of the Galaxy Vol. 3 (2023),2023,https://m.media-amazon.com/images/M/MV5BMDgxOTdjMzYtZGQxMS00ZTAzLWI4Y2UtMTQzN2VlYjYyZWRiXkEyXkFqcGdeQXVyMTkxNjUyNQ@@._V1_Ratio0.6763_AL_.jpg,"James Gunn (director), Chris Pratt, Chukwudi Iwuji, Bradley Cooper, Pom Klementieff",7.9,347501
tt1462764,90,+31,Indiana Jones and the Dial of Destiny,Indiana Jones and the Dial of Destiny (2023),2023,https://m.media-amazon.com/images/M/MV5BY2M0ZGEwMGQtNzMxOC00OTU2LWExZmUtMTA5N2RhMDZlY2JiXkEyXkFqcGdeQXVyODE5NzE3OTE@._V1_Ratio0.6763_AL_.jpg,"James Mangold (director), Harrison Ford, Phoebe Waller-Bridge, Antonio Banderas, Karen Allen",6.6,145998
tt0032138,91,+675,The Wizard of Oz,The Wizard of Oz (1939),1939,https://m.media-amazon.com/images/M/MV5BNjUyMTc4MDExMV5BMl5BanBnXkFtZTgwNDg0NDIwMjE@._V1_Ratio0.6763_AL_.jpg,"Victor Fleming (director), King Vidor (director), Judy Garland, Frank Morgan, Ray Bolger, Bert Lahr",8.1,420266
tt4495098,92,-11,Gran Turismo,Gran Turismo (2023),2023,https://m.media-amazon.com/images/M/MV5BMTI1YjFmN2UtOWZhOC00MjkwLTg2ZjgtNDQ5NDQ3YWNmNGRkXkEyXkFqcGdeQXVyMTAxNzQ1NzI@._V1_Ratio0.6763_AL_.jpg,"Neill Blomkamp (director), David Harbour, Orlando Bloom, Archie Madekwe, Takehiro Hira",7.2,60922
tt1446714,93,+79,Prometheus,Prometheus (2012),2012,https://m.media-amazon.com/images/M/MV5BMTY3NzIyNTA2NV5BMl5BanBnXkFtZTcwNzE2NjI4Nw@@._V1_Ratio0.6763_AL_.jpg,"Ridley Scott (director), Noomi Rapace, Logan Marshall-Green, Michael Fassbender, Charlize Theron",7,633788
tt6587046,94,-14,The Boy and the Heron,The Boy and the Heron (2023),2023,https://m.media-amazon.com/images/M/MV5BZjZkNThjNTMtOGU0Ni00ZDliLThmNGUtZmMxNWQ3YzAxZTQ1XkEyXkFqcGdeQXVyMTUzMTg2ODkz._V1_Ratio0.6860_AL_.jpg,"Hayao Miyazaki (director), Soma Santoki, Masaki Suda, Takuya Kimura, Aimyon",7.6,6953
tt6718170,95,-23,The Super Mario Bros. Movie,The Super Mario Bros. Movie (2023),2023,https://m.media-amazon.com/images/M/MV5BOTJhNzlmNzctNTU5Yy00N2YwLThhMjQtZDM0YjEzN2Y0ZjNhXkEyXkFqcGdeQXVyMTEwMTQ4MzU5._V1_Ratio0.6763_AL_.jpg,"Aaron Horvath (director), Michael Jelenic (director), Pierre Leduc (director), Fabien Polack (director), Chris Pratt, Anya Taylor-Joy, Charlie Day, Jack Black",7.1,207104
tt3291150,96,-3,Expend4bles,Expend4bles (2023),2023,https://m.media-amazon.com/images/M/MV5BMDFhYjc2NmUtNDBlOC00NDE5LTk5YWYtYmM4ZmMxNTUxMGNjXkEyXkFqcGdeQXVyMjM4NTM5NDY@._V1_Ratio0.6763_AL_.jpg,"Scott Waugh (director), Jason Statham, 50 Cent, Megan Fox, Dolph Lundgren",4.8,26147
tt0993846,97,-6,The Wolf of Wall Street,The Wolf of Wall Street (2013),2013,https://m.media-amazon.com/images/M/MV5BMjIxMjgxNTk0MF5BMl5BanBnXkFtZTgwNjIyOTg2MDE@._V1_Ratio0.6763_AL_.jpg,"Martin Scorsese (director), Leonardo DiCaprio, Jonah Hill, Margot Robbie, Matthew McConaughey",8.2,1532082
tt4513678,98,+28,Ghostbusters: Afterlife,Ghostbusters: Afterlife (2021),2021,https://m.media-amazon.com/images/M/MV5BNDRhNmUwMDktZGZjZS00NWY4LWIyNWItYmZmNWJiMDBiNDQzXkEyXkFqcGdeQXVyMTQyMTMwOTk0._V1_Ratio0.6763_AL_.jpg,"Jason Reitman (director), Carrie Coon, Paul Rudd, Finn Wolfhard, Mckenna Grace",7.1,205319
tt24870072,99,-72,Locked In,Locked In (2023),2023,https://m.media-amazon.com/images/M/MV5BNDFlYWQxMDItMzQxMS00YzE0LWI2MDctNzRmOTAxYjA2YjViXkEyXkFqcGdeQXVyNDQwMTQ5ODk@._V1_Ratio0.8019_AL_.jpg,"Nour Wazzi (director), Famke Janssen, Rose Williams, Alex Hassell, Finn Cole",5.1,6440
tt27921620,100,+2614,All-Time High,All-Time High (2023),2023,https://m.media-amazon.com/images/M/MV5BN2FjZDRkY2UtODU4Ni00ZmM0LTgxODMtYmY2ZTE2M2MyNTBhXkEyXkFqcGdeQXVyMTUyMzg5NzM2._V1_Ratio0.7150_AL_.jpg,"Julien Hollande (director), Nassim Lyes, Zoé Marchal, Adrien Essamir, Youssef Ramal",5.7,1133
